{"protocolVersion":1,"type":"result","requestId":"analysis-poll-1","result":{"runId":"0198a1b2-3c4d-4e5f-8a9b-0123456789ab","state":"interrupted","repository":{"repositoryId":"5298a1b2-3c4d-4e5f-8a9b-0123456789ab","displayName":"change_lens","canonicalPath":"/projects/change_lens","head":"0123456789abcdef0123456789abcdef01234567"},"comparison":{"target":"refs/heads/feature/comparison","targetRevision":"89abcdef0123456789abcdef0123456789abcdef","freshnessToken":"0123456789abcdef0123456789abcdef0123456789abcdef0123456789abcdef"},"requestedAt":1720000000000,"captureStartedAt":1720000000100,"capturedAt":null,"snapshotId":null,"cancellationRequested":false,"facts":[],"terminal":null,"interruptedAt":1720000000600,"interruptionReason":"engineStopped","readingModel":null,"validationRemovals":null}}
