{
  "protocolVersion": 1,
  "type": "result",
  "requestId": "desktop-43",
  "result": {
    "repositoryId": "01234567-89ab-cdef-0123-456789abcdef",
    "repository": {
      "name": "change_lens",
      "canonicalPath": "/projects/change_lens",
      "head": {
        "kind": "detached",
        "revision": "0123456789abcdef0123456789abcdef01234567"
      }
    },
    "preferredTarget": null
  }
}
