{"protocolVersion":1,"type":"result","requestId":"analysis-poll-1","result":{"runId":"0198a1b2-3c4d-4e5f-8a9b-0123456789ab","state":"completedWithLimitations","repository":{"repositoryId":"5298a1b2-3c4d-4e5f-8a9b-0123456789ab","displayName":"change_lens","canonicalPath":"/projects/change_lens","head":"0123456789abcdef0123456789abcdef01234567"},"comparison":{"target":"refs/heads/feature/comparison","targetRevision":"89abcdef0123456789abcdef0123456789abcdef","freshnessToken":"0123456789abcdef0123456789abcdef0123456789abcdef0123456789abcdef"},"requestedAt":1720000000000,"captureStartedAt":1720000000100,"capturedAt":1720000000200,"snapshotId":"7a98a1b2-3c4d-4e5f-8a9b-0123456789ab","cancellationRequested":false,"facts":[{"kind":"changedFilesCaptured","count":3,"detail":null},{"kind":"excludedUncommittedFiles","count":1,"detail":"1 unstaged"},{"kind":"correspondenceCandidates","count":4,"detail":null},{"kind":"disclosedEvidenceNodes","count":2,"detail":null},{"kind":"validationRemovals","count":3,"detail":null}],"terminal":{"kind":"completedWithLimitations","terminalAt":1720000000500,"limitationCount":1},"interruptedAt":null,"interruptionReason":null,"readingModel":{"thesis":{"claimId":"thesis","text":"The parser rejects an empty name.","trust":"unchecked","evidenceNodeIds":["n1"]},"areas":[{"id":"parse","title":"Name check","summary":{"claimId":"track:parse:summary","text":"Empty names fail.","trust":"unchecked","evidenceNodeIds":["n1"]},"shape":"walk","participants":[{"id":"parser","name":"Parser","role":"changed type","changed":true,"evidenceNodeIds":["n1"]}],"relationships":[],"orderedSteps":[{"claimId":"track:parse:step:0","text":"Reject the empty name.","trust":"unchecked","evidenceNodeIds":["n1"]}],"purposes":[]}],"citations":[{"claimId":"track:parse:step:0","nodeId":"n1","side":"after","path":"src/Name.cs","objectId":"0123456789abcdef0123456789abcdef01234567","startLine":10,"endLine":18,"focus":[{"nodeId":"n1","startLine":12,"endLine":12},{"nodeId":"n1","startLine":16,"endLine":17}],"provenance":"unchecked"},{"claimId":"finding:f1","nodeId":"n1","side":"after","path":"src/Name.cs","objectId":"0123456789abcdef0123456789abcdef01234567","startLine":10,"endLine":18,"focus":[{"nodeId":"n1","startLine":14,"endLine":14}],"provenance":"unchecked"},{"claimId":"finding:f2","nodeId":"n2","side":"after","path":"src/Other.cs","objectId":"89abcdef0123456789abcdef0123456789abcdef","startLine":1,"endLine":4,"focus":[{"nodeId":"n2","startLine":3,"endLine":3}],"provenance":"unchecked"}],"evidence":[{"nodeId":"n1","path":"src/Name.cs","side":"after","startLine":10,"endLine":18,"isChangedFile":true,"isRedacted":false,"isTruncated":false,"text":"public sealed class Name\n{\n    public static Name Parse(string value)\n    {\n        if (value.Length == 0)\n        {\n            throw new ArgumentException(\"empty\");\n        }\n        return new Name(value);"},{"nodeId":"n2","path":"src/Other.cs","side":"after","startLine":1,"endLine":4,"isChangedFile":true,"isRedacted":false,"isTruncated":false,"text":"public class Other\n{\n    public int Size => items.Count - 1;\n}"}],"limitations":[{"kind":"fileNotRead","path":"assets/blob.bin","detail":"binary content"},{"kind":"uncommittedWorkExcluded","path":null,"detail":"1 uncommitted lineages excluded (0 staged, 1 unstaged, 0 untracked, 0 conflicted)."}],"omissionSummaries":[{"sourceKind":"fileNotRead","reason":"binary content","totalCount":1,"sampleCount":1,"resolvedSampleCount":1}],"assurances":[{"kind":"checkerNotRun","detail":"Claim checking was not run.","claimId":null},{"kind":"buildNotExecuted","detail":"The build was not executed by publication.","claimId":null}],"findings":[{"id":"f1","severity":"warning","title":"Empty names are rejected only after the length check","trigger":"Parse is called with a whitespace-only name.","impact":"A blank name passes validation and creates an unusable Name.","fix":"Reject names that are empty or whitespace.","areaId":"parse"},{"id":"f2","severity":"info","title":"Size undercounts by one","trigger":"Size is read on a collection with one item.","impact":"Callers see zero items.","fix":"Return items.Count.","areaId":null}],"review":{"status":"ran","recommendation":"issuesWorthAddressing","withheldCount":2}},"validationRemovals":[{"scope":"statement","id":"thesis","reason":"stripped undisclosed evidence node id(s): missing"},{"scope":"finding","id":"findings[10]","reason":"overCap"},{"scope":"finding","id":"f3","reason":"undisclosedEvidence"}]}}
