{
  "protocolVersion": 1,
  "type": "result",
  "requestId": "comparison-prepare-empty",
  "result": {
    "repository": {
      "name": "change_lens",
      "canonicalPath": "/projects/change_lens",
      "head": {
        "kind": "detached",
        "revision": "0123456789abcdef0123456789abcdef01234567"
      }
    },
    "target": {
      "kind": "local",
      "name": "main",
      "fullName": "refs/heads/main",
      "revision": "0123456789abcdef0123456789abcdef01234567"
    },
    "mergeBaseRevision": "0123456789abcdef0123456789abcdef01234567",
    "currentWorkCommitCount": 0,
    "targetOnlyCommitCount": 0,
    "changedFileTotal": 0,
    "uncommittedFileTotal": 0,
    "stagedFileCount": 0,
    "unstagedFileCount": 0,
    "untrackedFileCount": 0,
    "readiness": {
      "state": "empty"
    },
    "freshnessToken": "89abcdef0123456789abcdef0123456789abcdef0123456789abcdef01234567"
  }
}
